
<?xml version="1.0" encoding="ISO-8859-1"?>
<cooperativa xmlns:xsi="http://www.w3.org/2001/XMLSchema-instance" xsi:noNamespaceSchemaLocation="a6_coopRK.xsd">
  <soci>
    <numero>1</numero>
    <data>2022-01-01</data>
    <nom>John</nom>
    <cognoms>Doe</cognoms>
    <data_naixement>1990-01-01</data_naixement>
    <edat>32</edat>
    <telefons>
      <telefon>123456789</telefon>
    </telefons>
  </soci>
  <soci>
    <clau>ABC123</clau>
    <nom>Jane</nom>
    <cognoms>Smith</cognoms>
    <telefons>
      <telefon>987654321</telefon>
      <telefon>555555555</telefon>
    </telefons>
  </soci>
  <soci>
    <numero>3</numero>
    <data>2022-02-01</data>
    <nom>Michael</nom>
    <cognoms>Johnson</cognoms>
    <telefons>
      <telefon>111111111</telefon>
      <telefon>222222222</telefon>
      <telefon>333333333</telefon>
    </telefons>
  </soci>
  <soci>
    <clau>XYZ789</clau>
    <nom>Emily</nom>
    <cognoms>Williams</cognoms>
    <data_naixement>1985-05-10</data_naixement>
    <telefons>
      <telefon>444444444</telefon>
    </telefons>
  </soci>
  <soci>
    <numero>5</numero>
    <data>2022-03-01</data>
    <nom>David</nom>
    <cognoms>Brown</cognoms>
    <edat>45</edat>
    <telefons>
      <telefon>555555555</telefon>
      <telefon>666666666</telefon>
    </telefons>
  </soci>
  <soci>
    <clau>PQR456</clau>
    <nom>Sarah</nom>
    <cognoms>Johnson</cognoms>
    <data_naixement>1998-12-25</data_naixement>
    <edat>23</edat>
    <telefons>
      <telefon>777777777</telefon>
      <telefon>888888888</telefon>
      <telefon>999999999</telefon>
    </telefons>
  </soci>
</cooperativa>
